{
  "id": "sell-volume-0003",
  "version": "0.1.0",
  "oracle": {
    "repo": "cowprotocol/services",
    "commit": "67cd3a16ad5b5cbfec16d8404ae038ee9e7019ed",
    "generated_by": "hand",
    "citations": [
      "crates/driver/src/domain/competition/solution/fee.rs:42-81",
      "crates/driver/src/domain/competition/solution/fee.rs:84-213",
      "crates/driver/src/domain/competition/solution/trade.rs:129-166",
      "crates/driver/src/domain/competition/solution/trade.rs:197-281",
      "crates/driver/src/domain/competition/solution/trade.rs:287-355",
      "crates/driver/src/domain/competition/solution/settlement.rs:290-305",
      "crates/winner-selection/src/arbitrator.rs:313-362",
      "crates/winner-selection/src/arbitrator.rs:367-426",
      "crates/winner-selection/src/arbitrator.rs:444-473",
      "crates/winner-selection/src/arbitrator.rs:539-632",
      "crates/chain-types/src/lib.rs:43-47",
      "crates/number/src/u256_ext.rs:105-135"
    ]
  },
  "class": [
    "sell",
    "full-fill",
    "policy-volume",
    "roundtrip-rounding"
  ],
  "order": {
    "uid": "0xd0156841c0eccaf6507cfe635e386eb5b9dd57a24874ba658b5bf0682ba8f069c0c0c0c0c0c0c0c0c0c0c0c0c0c0c0c0c0c0c0c0ffffffff",
    "side": "sell",
    "sell_token": "0xa0a0a0a0a0a0a0a0a0a0a0a0a0a0a0a0a0a0a0a0",
    "buy_token": "0xb0b0b0b0b0b0b0b0b0b0b0b0b0b0b0b0b0b0b0b0",
    "sell_amount": "7000000000000000000",
    "buy_amount": "13000000000000000000",
    "partially_fillable": false,
    "fee_policies": [
      {
        "kind": "volume",
        "cip": "CIP-38",
        "factor": 0.0002
      }
    ]
  },
  "native_prices": {
    "0xa0a0a0a0a0a0a0a0a0a0a0a0a0a0a0a0a0a0a0a0": "1000417000000000",
    "0xb0b0b0b0b0b0b0b0b0b0b0b0b0b0b0b0b0b0b0b0": "500000061000000"
  },
  "solution": {
    "executed": "6999000000000000000",
    "solver_fee": "1000000000000000",
    "uniform_clearing_prices": {
      "0xa0a0a0a0a0a0a0a0a0a0a0a0a0a0a0a0a0a0a0a0": "1999870013",
      "0xb0b0b0b0b0b0b0b0b0b0b0b0b0b0b0b0b0b0b0b0": "1000000123"
    }
  },
  "expected": {
    "fee_stage": {
      "protocol_fees": [
        {
          "policy_index": 0,
          "in_surplus_token": "2799417699869022",
          "in_sell_token": "1399799999999999"
        }
      ],
      "executed_after_fees": "6997600200000000001",
      "fee_after_fees": "2399799999999999",
      "custom_clearing_prices": {
        "sell": "13994289081645245560",
        "buy": "7000000000000000000"
      }
    },
    "score_stage": {
      "user_surplus": "994289081645245560",
      "protocol_fees_recovered": [
        "2799417699869018"
      ],
      "score_native": "498544310494955"
    },
    "notes": "The score stage's recovered fee differs from the driver's applied fee by rounding (policy 0: 2799417699869022 forward, 2799417699869018 recovered; surplus-token wei). Recovery works on post-fee amounts with f/(1-f) or f/(1+f) (arbitrator.rs:539-573)."
  }
}
